{
  "$schema": "https://json-schema.org/draft/2020-12/schema",
  "$id": "https://litigation-platform.local/case-box-contract/case-box-audit-event.schema.json",
  "title": "CaseBoxAuditEvent",
  "description": "Append-only audit event with hash-chain shape. Chain integrity (replay-tamper-detection) is enforced by case-box-persistence; the contract carries the SHAPE only.",
  "type": "object",
  "required": [
    "id",
    "tenant_id",
    "actor_user_id",
    "matter_id",
    "action",
    "entity_type",
    "entity_id",
    "after_state_hash",
    "timestamp"
  ],
  "properties": {
    "id":            { "$ref": "#/$defs/ulid" },
    "tenant_id":     { "type": "string", "minLength": 1 },
    "actor_user_id": { "type": "string", "minLength": 1 },
    "matter_id":     { "$ref": "#/$defs/ulid" },
    "action": {
      "enum": [
        "create",
        "update",
        "delete-soft",
        "access",
        "export",
        "print",
        "share",
        "privilege-waive",
        "delete-hard"
      ]
    },
    "entity_type": {
      "enum": ["matter", "document", "deadline", "evidence_item", "ocr_link", "fact", "privilege_marker", "confidentiality_classification", "docket_entry", "link", "claim_track", "evidence_preparation", "cross_examination_opinion", "legal_opinion_card"],
      "description": "v1 case-box entity vocabulary. Tightened from free-string to enum in Step 4. Extended in Step 5 (confidentiality_classification), Step 6 (docket_entry), and WI-A3-UNLINK-AUDIT-KINDS (link — the A3 evidence anchor/link, for unlink/relink audit). Future entities require a coordinated schema update + TS CASE_BOX_AUDIT_ENTITY_TYPES update."
    },
    "entity_id": { "$ref": "#/$defs/ulid" },
    "before_state_hash": {
      "anyOf": [
        { "type": "null" },
        { "type": "string", "minLength": 1 }
      ],
      "description": "Null on create; non-null otherwise."
    },
    "after_state_hash": {
      "type": "string",
      "minLength": 1,
      "description": "sha256 of canonicalized post-state."
    },
    "prev_event_hash": {
      "anyOf": [
        { "type": "null" },
        { "type": "string", "minLength": 1 }
      ],
      "description": "Null only on the first audit event for a matter. Non-null otherwise."
    },
    "timestamp": {
      "type": "string",
      "format": "date-time"
    },
    "reason": {
      "type": "string",
      "minLength": 1,
      "description": "Required when action is \"privilege-waive\". Optional otherwise."
    },
    "event_kind": {
      "description": "v2 normalized audit-event kind (ADR audit-event-kind-preservation) — a CASE_BOX_AUDIT_EVENT_KINDS key. Present iff audit_schema_version is present (v2 events); absent on legacy v1 events. Hashed in the v2 canonicalization. The chain verifier (verifyAuditChain) additionally enforces that the kind's declared {action, entity_type, reasonRequired} matches the event.",
      "enum": [
        "MATTER_REGISTERED", "MATTER_ARCHIVED", "MATTER_UNARCHIVED", "MATTER_PARTY_IDS_ASSIGNED", "MATTER_DETAILS_UPDATED",
        "DOCUMENT_REGISTERED", "DOCUMENT_OCR_SUBMITTED", "DOCUMENT_OCR_COMPLETE", "DOCUMENT_OCR_FAILED",
        "DOCUMENT_TRIAGED", "DOCUMENT_TAGGED", "DOCUMENT_REVIEWED", "DOCUMENT_SOFT_DELETED",
        "OCR_LINK_SNAPSHOTTED", "OCR_LINK_REFRESHED",
        "DEADLINE_REGISTERED", "DEADLINE_MET", "DEADLINE_MISSED", "DEADLINE_WITHDRAWN", "DEADLINE_MISSED_TO_MET",
        "EVIDENCE_PROPOSED", "EVIDENCE_ACCEPTED", "EVIDENCE_REJECTED", "EVIDENCE_SUPERSEDED",
        "FACT_PROPOSED", "FACT_REVIEWED", "FACT_ACCEPTED", "FACT_REJECTED", "FACT_REPLACEMENT_ACCEPTED",
        "PRIVILEGE_MARKER_PROPOSED", "PRIVILEGE_MARKER_CONFIRMED", "PRIVILEGE_MARKER_DISMISSED", "PRIVILEGE_MARKER_WAIVED",
        "EXTERNAL_OCR_AUTHORIZED", "EXTERNAL_OCR_REVOKED",
        "SYNC_GRANT_GRANTED", "SYNC_GRANT_REVOKED",
        "LLM_EXTRACTION_OPT_IN", "LLM_EXTRACTION_OPT_OUT",
        "PRIVILEGE_LOG_EXPORTED", "CASE_DATA_EXPORTED",
        "DOCUMENT_ACCESSED", "DOCUMENT_PRINTED", "DOCUMENT_SHARED",
        "CLASSIFICATION_SET", "CLASSIFICATION_UPGRADED", "CLASSIFICATION_DOWNGRADED", "CLASSIFICATION_RESET_TO_UNCLASSIFIED",
        "DOCKET_ENTRY_PROPOSED", "DOCKET_ENTRY_CONFIRMED", "DOCKET_ENTRY_DISMISSED", "DOCKET_ENTRY_REVISED",
        "LINK_UNLINKED", "LINK_RELINKED", "LINK_CREATED",
        "CLAIM_TRACK_CREATED", "CLAIM_TRACK_UPDATED", "CLAIM_TRACK_WITHDRAWN", "CLAIM_TRACK_RESOLVED", "CLAIM_TRACK_DELETED",
        "EVIDENCE_PREPARATION_CREATED", "EVIDENCE_PREPARATION_UPDATED", "EVIDENCE_PREPARATION_DELETED",
        "CROSS_EXAM_OPINION_CREATED", "CROSS_EXAM_OPINION_UPDATED", "CROSS_EXAM_OPINION_DELETED",
        "LEGAL_OPINION_CARD_CREATED", "LEGAL_OPINION_CARD_UPDATED", "LEGAL_OPINION_CARD_DELETED", "LEGAL_OPINION_CARD_USED_IN_TRIAL_SET", "LEGAL_OPINION_CARD_USED_IN_TRIAL_CLEARED", "LEGAL_OPINION_CARD_FOLLOW_UP_SET", "LEGAL_OPINION_CARD_FOLLOW_UP_CLEARED"
      ]
    },
    "audit_schema_version": {
      "const": 2,
      "description": "Audit-event canonicalization version. v2 events set this to 2 (the value is hashed in the v2 canonicalization); absent on legacy v1 events. Present iff event_kind is present."
    },
    "changed_fields": {
      "type": "array",
      "items": {
        "type": "string",
        "enum": ["name", "retainer_scope", "case_type_text", "case_progress_text", "court_contact_text", "contention_summary_text"]
      },
      "uniqueItems": true,
      "minItems": 1,
      "description": "matter-details-edit Phase A (D5a). The narrow, structured list of the 6 editable free-text matter fields that materially changed in a MATTER_DETAILS_UPDATED edit. MUST be in canonical SORTED order (ascending by field name): the field is a semantic SET, but the v2 canonicalization hashes array order EXACTLY, so an unsorted array would hash a different value for the same change-set. JSON Schema cannot enforce sortedness declaratively — the Phase-B persistence emitter MUST sort before append (enforced + tested in Phase B); this schema enforces only allowlist membership, uniqueness, and non-empty. Allowed ONLY on event_kind === \"MATTER_DETAILS_UPDATED\" (allOf conditional below); forbidden on every other kind. Hashed in the v2 canonicalization (tamper-evident). NOT a generic metadata escape hatch."
    }
  },
  "allOf": [
    {
      "if": {
        "properties": { "action": { "const": "privilege-waive" } },
        "required": ["action"]
      },
      "then": {
        "required": ["reason"],
        "properties": {
          "reason": { "type": "string", "minLength": 1 }
        }
      }
    },
    {
      "description": "changed_fields is allowed ONLY on a MATTER_DETAILS_UPDATED event; forbidden on every other kind (and on legacy v1 events with no event_kind).",
      "if": {
        "properties": { "event_kind": { "const": "MATTER_DETAILS_UPDATED" } },
        "required": ["event_kind"]
      },
      "then": true,
      "else": {
        "properties": { "changed_fields": false }
      }
    }
  ],
  "dependentRequired": {
    "event_kind": ["audit_schema_version"],
    "audit_schema_version": ["event_kind"]
  },
  "additionalProperties": false,
  "$defs": {
    "ulid": {
      "type": "string",
      "pattern": "^[0-9a-z]{26}$"
    }
  }
}
